序號,補習班名稱,稽查日期,班址,違規情形,處理情形,發文日期,發文字號
50,新竹市私立永曜文理短期補習班,2018-09-05,新竹市建功一路170號1-4樓,未出示定型化契約、未出示補習班個人資料安全維護計畫、未辦理履約保證機制、立案證書未懸掛於班內明顯處、收費收據未記載退費規定、懸掛招牌書寫安親班課輔班字樣,限期改善件次,2018-09-07,府教社字第1070137163號
51,新竹市私立成功文理短期補習班,2018-08-29,新竹市東門街46號4樓(93.05.05府教社字第0930055571號函准予變更班址),未出示補習班個人資料維護計畫書、未辦理履約保證機制、收費收據有記載退費規定，惟與本府規定不符合、擅自增設科目、違規擴大使用新竹市中華路二段312巷11號1-4樓,限期改善件次,2018-08-31,府教社字第1070133742號
52,新竹市私立史丹佛美語短期補習班,2018-07-04,新竹市光明里14鄰大學路81巷3弄51號,2樓緩降機周圍操作障礙，未保有操作面積，開口面積障礙且下降空間障礙。頂樓避難方向指示燈方向錯誤。未出示補習班個人資料安全維護計畫。新竹市補習班資訊系統登錄教職員工資料不完整。未出示收費收據。立案證書未懸掛於班內明顯處。,限期改善件次,2018-07-06,府教社字第1070106071號
53,弋果文化事業股份有限公司附設新竹市私立旗艦美語短期補習班,2018-07-04,新竹市金山六街5號,未出示與學生簽立定型化契約。未出示補習班個人資料維護計劃。於新竹市補習班資訊系統登錄教職員工資料不完整。立案證書未懸掛於班內明顯處。擅自增設科目。擅自擴大班舍。,限期改善件次,2018-07-09,府教社字第1070106556號
54,新竹市弋果美語短期補習班,2018-07-04,"新竹市金山七 街27號2樓",未出示與學生簽立定型化契約。未出示補習班個人資料維護計劃。於新竹市補習班資訊系統登錄教職員工資料不完整。未出示收費收據。立案證書未懸掛於班內明顯處。現場為幼兒園使用，2樓設有廚房及用餐區，無補習班之用途。,限期改善件次,2018-07-09,府教社字第1070106231號
55,新竹市私立李安文理短期補習班,2018-06-27,新竹市東門街48號、50號7樓,未出示公共意外責任險保單。未出與學生簽立定型化契約。未出示補習班個人資料安全維護計劃。未出示收費收據。違規擴大班舍。,限期改善件次,2018-07-05,府教社字第1070104880號
56,新竹市私立竹辰美語短期補習班,2018-06-13,新竹市東光路47號1樓至2樓,涉及課照、有使用交通車載送學生，車輛請依規報府備查。,限期改善件次,2018-06-22,府教社字第1070095675
57,新竹市私立快樂地文理短期補習班,2018-06-06,新竹市東大路3段380-2號1-2樓,擅自將東大路3段380-2號3樓作為班舍使用,限期改善件次,2018-06-15,府教社字第1070092338號
58,新竹市私立漢聲文理短期補習班,2018-05-30,新竹市東大路四段273號2樓至4樓,擅自遷址至延平路三段513號1樓作為班舍使用,限期改善件次,2018-06-05,府教社字第1070088654號
59,新竹市私立英翰英語短期補習班,2018-05-16,新竹市自由路109號1樓至2樓,涉及課照、擅自擴增班舍,限期改善件次,2018-05-30,府教社字第1070084077號
60,新竹市私立維肯美語文理短期補習班,2018-05-09,新竹市湳雅街91-1號4樓,未出示與學生簽立之定型化契約,限期改善件次,2018-05-29,府教社字第1070084075號
61,新竹市私立迅英美語短期補習班,2018-04-18,新竹市林森路187號3樓之4,已無營業跡象,公告撤銷立案,2018-06-13,府教社字第1070087050號
62,新竹市私立嘉因文理短期補習班,2018-03-28,新竹市民族路265號1、2樓及閣樓；民族路269號2樓、3樓,涉及課照,限期改善件次,2018-04-03,府教社字第1070055959號
63,新竹市私立佳典文理短期補習班,2018-03-21,新竹市東區關新北路181號1樓(關新北路183號1樓至2樓),違規變更班址,限期改善件次,2018-03-30,府教社字第1070054703號
64,新竹市私立愛迪標文理短期補習班,2017-09-06,新竹市光復路2段298巷7弄16號1樓,班務缺失、違規擴大使用班舍,限期改善件次,2017-09-22,府教社字第1060139611號
65,新竹市私立傑揚文理短期補習班,2017-08-23,新竹市埔頂路123號A棟1樓及123號A棟2樓,班務缺失,限期改善件次,2017-08-30,府教社字第1060127509號
66,新竹市私立永曜文理短期補習班,2017-08-02,新竹市建功一路170號1-4樓,班務缺失、教室數與核定不符,限期改善件次,2017-08-07,府教社字第1060116200號
67,新竹市私立璽理文理短期補習班,2017-07-26,新竹市東南街271號1樓至2樓,班務缺失,限期改善件次,2017-08-07,府教社字第1060116093號
68,新竹市私立聯成電腦短期補習班,2017-07-19,新竹市中華路二段387號1-3樓,班務缺失及擅自遷址,限期改善件次,2017-08-04,府教社字第1060115450號
69,新竹市私立艾學爾文理短期補習班竹光分班,2017-06-28,新竹市延平路一段214巷67號1樓,"1.班務缺失 2.違規擴大使用延平路一段214巷67號2樓",限期改善件次,2017-07-31,府教社字第1060112359號
70,新竹市私立艾學爾文理短期補習班,2017-06-26,新竹市林森路169號地下1樓（辦公室）、1樓至4樓,擅自增設科目、招牌書寫課輔字樣,限期改善件次,2017-07-28,府教社字第1060111746號
71,新竹市私立艾學爾文理短期補習班牛埔分班,2017-06-21,新竹市香山區牛埔東路321號1樓至2樓,班務缺失、涉及課照,限期改善件次,2017-07-26,府教社字第1060111066號
72,新竹市私立學智文理短期補習班,2017-06-07,新竹市學府路443號1-2樓,班務缺失、違規擴大使用班舍,限期改善件次,2017-06-22,府教社字第1060092160號
73,新竹市私立文勝文理短期補習班,2017-05-17,新竹市湳中街121巷19號1樓至4樓,擅自遷址至湳中街121巷19號1樓至4樓,停止招生三個月,2017-06-16,府教社字第1060085181號
74,新竹市私立喬安文理短期補習班,2017-03-29,新竹市四維路100號1至4樓,班務缺失、違規擴大使用班舍,限期改善件次,2017-04-26,府教社字第1060064804號
75,新竹市私立誠樺語文技藝短期補習班,2017-03-15,新竹市金竹路124號1樓,班務缺失、擅自增設美術科、教室數與核定數不符,限期改善件次,2017-04-14,府教社字第1060057712號
76,新竹市私立立文文理短期補習班,2017-03-15,"30054  新竹市北區武陵路57號1至4樓",班務缺失、違規擴大使用班舍,限期改善件次,2017-04-14,府教社字第1060056964號
77,新竹市私立群英文理短期補習班,2017-03-01,新竹市關東路110號1-4樓,班務缺失、涉及課照,限期改善件次,2017-04-10,府教社字第1060054628號
78,新竹市私立教育家文理短期補習班關東分班,2017-03-01,新竹市關東路106號1樓至4樓,班務缺失、涉及課輔、教室數與核准不符,限期改善件次,2017-04-10,府教社字第1060048745號
79,新竹市私立大正短期補習班,2016-09-21,新竹市自由路101號2樓,懸掛招牌書寫三之三課輔班等字樣，涉違規經營課輔業務、現場教室5間，與核定間數(2間)不符,限期改善件次,2016-10-11,1050150107
80,支點資訊科技有限公司附設新竹市私立三民法政商業短期補習班,2016-05-25,新竹市東門街62號2樓,違規擴大使用東門街62號7樓。,限期改善件次,2016-06-08,1050091282
81,新竹市私立文勝文理短期補習班,2016-05-18,新竹市東大路二段226號1-3樓,違規擴大使用226號4樓,限期改善件次,2016-05-31,1050086409
82,新竹市私立育碩文理短期補習班,2016-04-20,新竹市民富街155、157、159號1樓,"1.懸掛招牌書寫「課輔」等字樣。 2.收據退費規定與本府規定不符。",限期改善件次,2016-05-03,1050071711
83,新竹市私立新華文理短期補習班,2016-03-02,新竹市大庄路56-5號1-4樓,違規擴增班址至大庄路130、132號,限期改善件次,2016-03-23,1050052934
84,新竹市私立法老師文理短期補習班,2013-11-13,新竹市民族路253號1樓,,限期改善件次,2013-11-27,
85,新竹市私立嘉因文理短期補習班,2013-03-20,民族路269號2樓至3樓,於1樓設置電腦使用區，且有學生在使用電腦及寫作業,糾正件次(列入違規紀錄),2013-04-11,府教社字第1020042204號函
86,私立國立短期補習班,2010-06-23,新竹市學府路66號2樓,,限期改善件次,2010-07-01,
87,私立宏泰物理短期補習班,2009-04-29,新竹市民族路31號5樓,未使用定型化契約,限期改善件次,2009-05-04,
88,私立朱尼爾短期補習班,2009-01-14,新竹市自由路67號2樓之1、2樓之2,違規擴增班舍另消防、建物安檢設備有缺失。,限期改善件次,2009-01-16,府教社字第0980005787號函
89,私立建宏三號文理短期補習班,2008-12-17,延平路一段214巷67號1樓,違規擴大班舍和未經本府核准已用車輛載送學生,限期改善件次,2008-12-26,
90,私立學立6號文理短期補習班,2008-10-16,新竹市延平路一段433號一樓,違規擴增班舍,限期改善件次,2008-10-22,府教社字第0970109094
91,私立王淵海文理短期補習班,2008-10-02,新竹市東門街62號2樓,無建物公安簽證.未使用定型化契約.未懸掛立案證書,限期改善件次,2008-10-08,
92,私立林格美語會話短期補習班,2008-07-17,新竹市科學園路107巷22號1~2樓,"未經核准擅自變更班址 無建物公安簽證",限期改善件次,2008-07-23,
93,私立唯智英語專修短期補習班(府教社字第0930058727號函核准變更班名),2007-09-27,中山路40巷27號1樓,擅自擴大班舍,限期改善件次,2007-10-15,府教社字第0960106708號
94,私立聯合文理短期補習班,2007-09-06,新竹市東門街34巷3號1之4樓,,限期改善件次,2007-10-12,府教社字第0960106256號
95,私立新豐數學文教學苑短期補習班,2007-06-07,新竹市延平路3段542-1號1~2樓,擅自擴充班舍至3樓,限期改善件次,2007-06-15,府教社字第0960061507號
96,私立學立文理短期補習班,2007-06-07,新竹市延平路3段204巷1號2樓,擴充班舍至1F、3F,限期改善件次,2007-06-14,府教社字第0960061274號
97,私立培心美語短期補習班,2007-05-10,新竹市光華二街165號1-2樓,消防部分缺失,限期改善件次,2007-05-24,府教社字第0960052408號
98,私立大衛美日語短期補習班,2007-05-03,新竹市科學園路139號,消防部分缺失,限期改善件次,2007-05-15,府教社字第0960049174
99,私立新皇家美語短期補習班(因門牌整編95.04.19府教社字第0950035074號函同意修正班址),2006-11-09,新竹市體育街32號,違規使用未經本府核准之班舍(該班址2樓),限期改善件次,2006-06-23,府教社字第0950060679號
100,私立新儒林文理短期補習班,2006-06-08,新竹市關東里光復路一段268巷63號4樓,收托學齡前兒童,糾正件次(列入違規紀錄),2006-06-23,府教社字第0950060634號
101,私立國際村美日語短期補習班,2004-08-31,新竹市光復路一段373之1號2樓,,限期改善件次,,
102,私立聯合文理短期補習班,2004-08-27,新竹市東門街34巷3號1之4樓,,限期改善件次,,
103,私立敦品數學短期短期補習班,2004-02-19,新竹市民族路六十五號,擅自遷移班址,停止招生六個月,2004-03-26,府教社字第0930042275號
104,私立紐約美語會話短期補習班,2004-02-14,新竹市北大路十五號一樓,招收學齡前兒童,限期改善件次,2004-02-27,府教社字第09300155997
105,私立育晟文理短期補習班,2004-02-12,新竹市學府路61巷5-6號,擅自遷址至新竹市學府路61巷5-6號,停止招生六個月,2004-03-16,府教社字第0930035183號
106,私立大和美日語短期補習班,2003-12-11,新竹市光復路1段526號2樓,擅自遷移班址,限期改善件次,2003-12-17,府教社字第0920106981號
107,私立育民英數理短期補習班,2003-11-13,新興里2鄰西大路23、25號,擅自遷移班址,停止招生六個月,2003-12-31,府教社字第0920118003號
108,私立上冠文理短期補習班,2003-10-23,新竹市東門街62號,擅自變更班址至本市東門街六十二號一、三樓,停止招生六個月,2003-12-31,府教社字第0920117986號
109,私立紐約美語短期補習班,2003-09-25,新竹市北大路15號1樓,,限期改善件次,,
110,私立育民英數理短期補習班,2003-06-26,新竹市西大路23號,班址遷址未報府核准,限期改善件次,2003-07-01,府教社字第0920053719號
111,私立上冠文理短期補習班,2003-06-16,新竹市三民理民族路161號,班址與立案地址不符,限期改善件次,2003-06-19,府教社字第0920050337
2,新竹市私立有玉音樂短期補習班,2024-05-15,新竹市中山路312巷22號1樓,其他班務違規,限期改善件次,,府教社字第1130087097號
3,新竹市私立凱特文理技藝短期補習班,2024-05-01,新竹市東區關東路147號1樓及2樓,其他班務違規,限期改善件次,2024-05-13,1130082669
4,新竹市私立亞立文理技藝短期補習班,2024-05-01,新竹市關東路125號2樓,其他班務違規,限期改善件次,2024-05-13,1130082670
6,新竹市私立佳美英語短期補習班,2024-04-10,新竹市西門街252號1-2樓,其他班務違規,限期改善件次,2024-04-17,府教社字第1130068812號
7,新竹市私立聯合文理短期補習班東南分班,2024-03-27,新竹市食品路191巷25號3樓,擅自擴大班舍、學生人數超過規定容量、其他班務違規,限期改善件次,2024-04-03,府教社字第1130060442號
8,新竹市私立竹大文理短期補習班,2024-03-27,新竹市食品路540號2樓,擅自擴大班舍、學生人數超過規定容量、其他班務違規,限期改善件次,2024-04-03,府教社字第1130060426號
9,新竹市私立孜學壹文理短期補習班,2024-03-27,新竹市食品路218號1樓至2樓,違反建築、消防相關規範、其他班務違規,限期改善件次,2024-04-03,府教社字第1130060437號
10,新竹市私立英維文理短期補習班,2024-03-20,新竹市北區四維路90號1-4樓,其他班務違規,限期改善件次,2024-04-08,府教社字第1130061288號
11,弋果文化事業股份有限公司附設新竹市私立弋果美語文理短期補習班經國分班,2023-12-25,新竹市經國路二段16號2樓至6樓,違規變更班址經國路二段16號1樓。,糾正件次(列入違規紀錄),2024-01-08,府教社字第1130016148號
13,大東海國際書局有限公司附設新竹市私立大東海法商短期補習班,2023-12-06,新竹市民族路7號2樓、7樓,"1.	未提供投保公共意外責任險。 2.	未提供與該班學生簽立定型化契約書。 3.	未提供補習班個人資料安全維護計畫。 4.	未提供線上登錄設立人、班主任、教職員工名冊 (身份證字號、西元出生年月日等)。 5.	未提供收費收據。 6.	立案證書未懸掛於班內明顯處。 7.	懸掛招牌班名與核准立案班名不符合，班名需註明立案字號。 8.	未有班主任登錄於補習班資訊系統。",糾正件次(列入違規紀錄),2024-01-04,府教社字第1130013897號
14,新竹市私立瀚銘文理短期補習班,2023-11-29,新竹市四維路77號1樓至4樓,"1.	有使用車輛載送學生，未報府核備。 2.	未提供與該班學生簽立定型化契約書。 3.	未提供補習班個人資料安全維護計畫。 4.	未提供線上登錄設立人、班主任、教職員工名冊 (身份證字號、西元出生年月日等)。 5.	提供電子收費收據未註明退費規定。 6.	擅自增設課輔班、正音班、全科班科目，與本府立案科目不符合。 7.	有一間教室作為儲藏室請於門上註明儲藏室。",糾正件次(列入違規紀錄),2023-12-05,府教社字第1120185932號
15,新竹市私立中和英語短期補習班,2023-11-29,新竹市中和路95巷7號1樓,1.未提供補習班個人資料安全維護計畫。2.擅自增設安親班、數學班科目，與本府立案科目不符合。,糾正件次(列入違規紀錄),2023-12-05,府教社字第1120185861號
16,新竹市弋果美語短期補習班,2023-11-22,新竹市金山七街27號2樓,"1..補習班收托幼兒(學齡前兒童)，與核准招生對象(國小)不符。 2.違規變更室內裝修，原立案10間教室現場稽查3間教室及有一間開放式廚房及2樓夾層。 3.補習班未有獨立大門出入口。",限期改善件次,2023-11-28,府教社字第1120182203號
17,新竹市私立喬太文理短期補習班,2023-11-15,新竹市經國路一段379巷41號3樓,,糾正件次(列入違規紀錄),2023-11-23,府教社字第1120177312號
18,新竹市私立東亞美容髮型短期補習班,2023-11-15,新竹市中華路二段508號4樓之1之2之3,"1.	未提供補習班個人資料安全維護計畫。 2.	未提供線上登錄設立人、班主任、教職員工名冊 (身份證字號、西元出生年月日等)。 3.	未提供收費收據。",糾正件次(列入違規紀錄),2023-11-21,府教社字第1120177365號
19,新竹市私立艾學爾文理短期補習班,2023-11-15,新竹市林森路169號地下1樓（辦公室）、1樓至4樓,"1.	未提供交通車核備公文。 2.	未與該班學生簽立定型化契約。 3.	未提供補習班個人資料安全維護計畫。",糾正件次(列入違規紀錄),2023-11-21,府教社字第1120177353號
20,小小科學家菁英文教股份有限公司附設新竹市私立小小科學家文理短期補習班,2023-11-15,新竹市民權路266號3樓之1、3樓之2,"1.	未投保公共意外責任險。 2.	未與該班學生簽立定型化契約。 3.	未提供補習班個人資料安全維護計畫。 4.	未提供完整正確之線上登錄設立人、班主任、教職員工名冊 (身份證字號、西元出生年月日等)。 5.	收費收據未記載完整之立案班名也未註明上課科別。 6.	懸掛之招牌班名與核准立案班名不符合。 7.	擅自增設科學實驗及程式設計之科別，與核准立案科目不符合。 8.	本府核准立案班級人數每班為27人，經現場稽查有三間教室（第6、7、8間）坐位逾核定人數。",糾正件次(列入違規紀錄),2023-11-21,府教社字第1120177327號
21,新竹市私立立文文理短期補習班,2023-10-25,"30054  新竹市北區武陵路57號1至4樓","1.	提供補習班個人資料安全維護計畫(簽名與系統教職員人數不符合)。 2.	未提供線上登錄設立人、班主任、教職員工名冊 (身份證字號、西元出生年月日等)，有2位老師未核備、1位行職員未核備。 3.	違規擴大使用武陵路57號1-5樓(原5間教室，現場稽查6間教室)。 4.	未遴用防火管理員、未使用具防焰標示之防焰物品、4樓避難器具緩降機下降空間障礙。",糾正件次(列入違規紀錄),2023-10-27,府教社字第1120165713號
22,新竹市私立丹尼爾文理技藝短期補習班,2023-10-13,新竹市東區關東路56號3樓,"1.未提供交通車逃生演練紀錄及保險證明。 2.違規擴大使用3樓左方兩間教室及後方一間教室；4樓遊樂設施及會議室1間",糾正件次(列入違規紀錄),2023-10-16,府教社字第1120159195號
23,新竹市私立李安貳號文理短期補習班,2023-09-21,新竹市中央路198號2樓,1.收費收據未記載退費規定。,糾正件次(列入違規紀錄),2023-09-26,府教社字第1120150352號
24,新竹市私立教育家文理短期補習班,2023-08-25,新竹市北區延平路一段37號2-4樓,"1.	未提供投保公共意外責任險。 2.	未提供線上登錄設立人、班主任、教職員工名冊(身份 證字號、西元出生年月日等)。 3.	立案證書未懸掛班內。 4.	違規擴大使用延平路一段37號2樓至6樓。(原立案教室3間，現場稽查5間) 5.	違規變更班址至延平路一段36號1樓(現場有3間教室)及37號2樓至6樓。 6.	本市延平路一段36號1樓及37號6樓，未辦理建築物公安簽證申報。  7.	本府核准立案班級人數每班為15人，經現場稽查部分教室逾核定人數。",糾正件次(列入違規紀錄),2023-08-28,府教社字第1120133832號
25,新竹市私立家偉文理技藝短期補習班,2023-07-19,新竹市東區關新路18號1-3樓,"1.	未與該班學生簽立定型化契約。 2.	未提供補習班個人資料安全維護計畫。 3.	未提供線上登錄設立人、班主任、教職員工名冊 (身份證字號、西元出生年月日等)現場有2位職員未核備。 4.	未提供收費收據。",糾正件次(列入違規紀錄),2023-07-24,府教社字第1120115629號
26,新竹市私立凱特文理技藝短期補習班,2023-07-19,新竹市東區關東路147號1樓及2樓,"1.	未與該班學生簽立定型化契約。 2.	未提供補習班個人資料安全維護計畫。 3.	未提供線上登錄設立人、班主任、教職員工名冊 (身份證字號、西元出生年月日等)。 4.	提供收費收據未記載退費規定。 5.	未辦理建築物公安簽證申報，請於15日內補辦。",糾正件次(列入違規紀錄),2023-07-24,府教社字第1120115590號
27,小小科學家教育事業股份有限公司附設新竹市私立科學家一號文理短期補習班,2023-07-12,新竹市光復路一段485巷11號1樓,"1.	未投保公共意外責任險。 2.	未提供補習班個人資料安全維護計畫。 3.	未提供線上登錄設立人、班主任、教職員工名冊 (身份證字號、西元出生年月日等)現場有1位老師未核備。 4.	未提供收費收據。 5.	懸掛招牌班名與核准立案班名不符。",糾正件次(列入違規紀錄),2023-07-20,府教社字第1120113843號
28,新竹市私立權慧文理短期補習班,2023-07-10,新竹市光華街95巷18號1樓,"1.	未提供建築物公共安全簽證申報都是發展處回函。 2.	未提供消防安檢申報收執聯。 3.	未與該班學生簽立定型化契約。 4.	提供補習班個人資料安全維護計畫(教職員未簽名)。 5.	未提供線上登錄設立人、班主任、教職員工名冊 (身份證字號、西元出生年月日等)，現場有6位教師未核備。 6.	未提供收費收據。 7.	擅自增設美術科、國小國語科、國中國文科。",糾正件次(列入違規紀錄),2023-07-18,府教社字第1120112476號
29,弋果文化事業股份有限公司附設新竹市私立弋果美語文理短期補習班關埔分班,2023-06-28,新竹市東區埔頂一路203號2樓至6樓,1.違規變更班址東區埔頂一路203號1樓。,糾正件次(列入違規紀錄),2023-07-04,府教社字第1120104457號
30,新竹市私立嘉德琳關埔美語短期補習班,2023-06-28,新竹市埔頂里埔頂三路146號1樓,"1.	有使用車輛載送學生，車輛未核備。",糾正件次(列入違規紀錄),2023-07-04,府教社字第1120104386號
31,新竹市私立鴻宇教育文理短期補習班,2023-05-10,新竹市北區中雅里延平路一段159巷8號1-4樓,"1. 未提供與該班學生簽立定型化契約。2.  未提供補習班個人資料安全維護計畫。3.  未提供線上登錄設立人、班主任、教職員工名冊 (身份證字號、西元出生年月日等)。(稽查有9位教師) 4. 收費收據有記載退費規定，為與本府規定不符。5.本府核准立案班級人數每班為14人，經現場稽查部分教室逾核定人數。",糾正件次(列入違規紀錄),2023-05-15,府教社字第1120077621號
32,新竹市私立伯特美語短期補習班,2023-04-13,新竹市光復路一段354巷2號1樓,"1.未投保公共意外責任險。2.	未與該班學生簽立定型化契約。3.未提供補習班個人資料安全維護計畫。4.未提供線上登錄設立人、班主任、教職員工名冊 (身份證字號、西元出生年月日等)。5.未提供收費收據。",糾正件次(列入違規紀錄),2023-04-13,府教社字第1120060876號
33,新竹市私立耕福田文理短期補習班,2023-03-22,新竹市民族路156之1號2樓至4樓,"1.未與該班學生簽立定型化契約。2.未提供補習班個人資料安全維護計畫。3.	未提供線上登錄設立人、班主任、教職員工名冊 (身份證字號、西元出生年月日等)。4.違規變更班址民族路156號2至4樓。5.	本府核准立案班級人數每班為10人，經現場稽查部分教室逾核定人數。6.	未辦理建築物公安簽證申報，現場張貼不合格告示，並限於7日內補辦；於未完成申報並取得通知書前，不得擅自撕毀告示，以免觸犯刑法第141條損毀文告罪。告示編號:1120322-01",糾正件次(列入違規紀錄),2023-03-31,府教社字第1120055602號
34,新竹市弋果美語短期補習班,2022-12-07,新竹市金山七街27號2樓,學生皆為幼兒園學生,糾正件次(列入違規紀錄),2022-12-16,府教社字第1110188038號
35,新竹市私立百分百短期補習班,2022-11-30,新竹市博愛街92巷8號1-2樓,"1.未提供投保公共意外責任險。2.未提供補習班個人資料安全維護計畫。3.未與該班學生簽立定型化契約書。4.未提供線上登錄設立人、班主任、教職員工名冊 (身份證字號、西元出生年月日等)。5.立案證書未懸掛於班內明顯處。6.違規擴大使用博愛街92巷8號1樓至2樓(原立案教室2間，現場稽查4間教室)作為班舍使用。7.        未落實補習班學生用餐衛生防護措施，用餐前後勤洗手，回座位噴酒精。8.未提供「短期補習班從業人員接種COVID-19防疫管理指引自我檢查表」。9.        建議現場可加裝住宅用火災警報器，已達火災早發現早應變之效。",糾正件次(列入違規紀錄),2022-12-05,府教社字第1110182354號
