序號,補習班名稱,稽查日期,班址,違規情形,處理情形,發文日期,發文字號
36,新竹市私立立弘文理短期補習班,2022-11-16,新竹市民富街169號2樓,現場無營業跡象,糾正件次(列入違規紀錄),2022-11-17,府教社字第1110175031號
37,新竹市私立印地安文理短期補習班,2022-11-16,新竹市金竹路82號1樓及78號1-3樓,1.未提供補習班個人資料安全維護計畫。2.懸掛招牌書寫安親班、課輔班字樣。3.擅自增設國中自然(理化)科目、國中全科科目、安親課輔科目、小一正音班。4.違規擴大使用金竹路78號1樓至3樓、82號1樓(原立案教室2間，現場稽查5間教室)作為班舍使用。,糾正件次(列入違規紀錄),2022-11-23,府教社字第1110176051號
38,新竹市私立康寧關新文理才藝短期補習班,2022-11-09,新竹市關新北路181號1樓,1.未提供與該班學生簽立定型化契約。2.有使用車輛載送學生，車輛未核備。3.未提供補習班個人資料安全維護計畫。4.違規變更班址至關新北路181號2樓，作為班舍使用。5.未提供「短期補習班從業人員接種COVID-19防疫管理指引自我檢查表」及「短期補習班從業人員接種COVID-19防疫名冊」。,糾正件次(列入違規紀錄),2022-11-17,府教社字第1110172191號
39,新竹市私立A1智慧教室文理短期補習班,2022-11-02,新竹市光復路一段268巷13號1樓,"1.未提供補習班個人資料安全維護計畫。2.未提供線上登錄設立人、班主任、教職員工名冊 (身份證字號、西元出生年月日等)。3.未與該班學生簽立定型化契約書。4.未提供收費收據。5.未懸掛立案證書。6.擅自增設幼兒園雙語先修科目、日文課科目。7.未提供投保公共意外責任險。8.未提供建築物公共安全簽證申報都市發展處回函。9. 未提供消防安檢申報收執單。未提供「短期補習班從業人員接種COVID-19防疫名冊」。",糾正件次(列入違規紀錄),2022-11-07,府教社字第1110168155號
40,新竹市私立德利國際語文技藝短期補習班,2022-11-02,新竹市光復路一段327號1樓至2樓,"1.未提供補習班個人資料安全維護計畫。2.未提供線上登錄設立人、班主任、教職員工名冊 (身份證字號、西元出生年月日等)。3.未與該班學生簽立定型化契約書。4.未提供收費收據。5.未懸掛立案證書。6.未提供投保公共意外責任險。7.未提供建築物公共安全簽證申報都市發展處回函。8.未提供消防安檢申報收執單。9.未提供「短期補習班從業人員接種COVID-19防疫名冊」。",糾正件次(列入違規紀錄),2022-11-07,府教社字第1110168209號
41,新竹市私立喬治美語文理短期補習班,2022-10-26,新竹市金竹路38號2-3樓,"1.未提供補習班個人資料安全維護計畫。2.未提供線上登錄設立人、班主任、教職員工名冊 (身份證字號、西元出生年月日等)。3.未與該班學生簽立定型化契約書。4.未提供收費收據。建議現場可加裝住宅用火災警報器，火災發生可以早發現早應變。5.建議現場可加裝住宅用火災警報器，火災發生可以早發現早應變。6.違規變更班址至金竹路38號1樓，作為班舍使用。7.未落實盤點從業人員及學生造冊(量體溫)。8.未提供「短期補習班從業人員接種COVID-19防疫管理指引自我檢查表」及「短期補習班從業人員接種COVID-19防疫名冊」。",糾正件次(列入違規紀錄),2022-11-02,府教社字第1110165928號
42,新竹市私立劍橋短期補習班,2022-10-19,新竹市光復路一段322號二樓,"1.未提供補習班個人資料安全維護計畫。2.未提供線上登錄設立人、班主任、教職員工名冊 (身份證字號、西元出生年月日等)。3.投保公共意外責任險已逾期。4.懸掛招牌書寫安親班、課輔班字樣。5.        後側逃生出口旁居室(儲藏空間)請依規檢討是否需增設火警探測器。6. 違規擴大使用光復路一段322號2樓(原立案教室3間，現場稽查6間教室)作為班舍使用。7. 未落實盤點從業人員及學生造冊(量體溫)。8. 未提供「短期補習班從業人員接種COVID-19防疫管理指引自我檢查表」。",糾正件次(列入違規紀錄),2022-10-24,府教社字第1110161908號
43,新竹市私立新世紀文理短期補習班,2022-10-19,新竹市光復路一段108巷38號1樓,現場無營業跡象,糾正件次(列入違規紀錄),2022-10-26,府教社字第1110163003號
44,新竹市私立華星文理短期補習班,2022-10-12,新竹市東山街32巷8號1樓,"1.未提供補習班個人資料安全維護計畫。2.未提供線上登錄設立人、班主任、教職員工名冊 (身份證字號、西元出生年月日等)。3.未提供與該班學生簽立定型化契約。4.未提供投保公共意外責任險。5.        未提供收費收據。6.未出示111年度消防安全設備檢修申報書。(未出示消防安檢申報收執單)7.未提供建築物公共安全簽證申報都市發展處回函。8.違規變更班址至東山街32巷8號地下一樓作為班舍使用。9.未提供「短期補習班從業人員接種COVID-19防疫管理指引自我檢查表」",糾正件次(列入違規紀錄),2022-10-19,府教社字第1110159568號
45,新竹市私立瑜躍文理短期補習班,2022-10-12,新竹市東山街51號及51號2樓,"1.未提供補習班個人資料安全維護計畫。2.未提供線上登錄設立人、班主任、教職員工名冊 (身份證字號、西元出生年月日等)。3.未提供與該班學生簽立定型化契約。4.未提供履約保證機制期繳文件。5.收費收據有記載退費規定，惟與本府規定不符合。6.緩降機旁堆放雜物，影響逃生使用。(建議設置一具避難器具標示燈)7.違規擴大使用東山街51號2樓(原立案教室4間，現場稽查5間教室)作為班舍使用。8.未落實盤點從業人員及學生造冊(量體溫)。9.        未提供「短期補習班從業人員接種COVID-19防疫管理指引自我檢查表」及「短期補習班從業人員接種COVID-19防疫名冊」。",糾正件次(列入違規紀錄),2022-10-19,府教社字第1110159358號
46,新竹市私立君明文理短期補習班,2022-10-12,新竹市東山街30號1樓,"1.未提供補習班個人資料安全維護計畫。2.未提供線上登錄設立人、班主任、教職員工名冊 (身份證字號、西元出生年月日等)3.未提供與該班學生簽立定型化契約4.投保公共意外責任險已逾期。5.未辦理建築物公安簽證申報(無建築物公共安全簽證申報都市發展處回函)。6.        地下一樓及地上2層請依規檢討設計(置)消防設備。7.違規擴大使用東山街30號地下一樓及2樓(原立案教室1間，現場稽查5間教室)作為班舍使用。8.未落實盤點從業人員及學生造冊(量體溫)。9.未提供「短期補習班從業人員接種COVID-19防疫管理指引自我檢查表」及「短期補習班從業人員接種COVID-19防疫名冊」。",糾正件次(列入違規紀錄),2022-10-19,府教社字第1110159593號
47,新竹市私立學立6號文理短期補習班,2022-09-14,新竹市延平路一段433號1樓,現場無營業跡象,糾正件次(列入違規紀錄),2022-09-14,府教社字第1110141198號
48,新竹市私立偉文文理短期補習班,2022-08-31,新竹市東門街46號2樓,"1.未提供補習班個人資料安全維護計畫。2.        未提供線上登錄設立人、班主任、教職員工名冊 (身份證字號、西元出生年月日等)。3.收費收據有記載退費規定，惟與本府規定不符合。4.        緩降機之操作空間不足，部分避難器具標示燈設置位置不當。5.        違規變更班址至東門街46號3樓，擅自作為班舍使用。6.        未落實盤點從業人員及學生造冊(量體溫)。7.        未提供「短期補習班從業人員接種COVID-19防疫管理指引自我檢查表」及「短期補習班從業人員接種COVID-19防疫名冊」。",糾正件次(列入違規紀錄),2022-09-02,府教社字第1110134735號
49,新竹市私立李安文理短期補習班,2022-08-31,新竹市東門街48號、50號7樓,"1.未提供補習班個人資料安全維護計畫。2.        未提供線上登錄設立人、班主任、教職員工名冊 (身份證字號、西元出生年月日等)。3.擅自增設國中數學科目、國中英檢科目、國三全科；小六家教數學班、國中國文科目、作文科目。4.        違規擴大使用東門街48、50號7樓。(原立案2間教室，現場稽查3間教室)5.緩降機之操作空間不足。(擺放課桌椅)6.出入人員未落實體溫量測及盤點從業人員及學生造冊。7.        未提供「短期補習班從業人員接種COVID-19防疫管理指引自我檢查表」及「短期補習班從業人員接種COVID-19防疫名冊」。",糾正件次(列入違規紀錄),2022-09-01,府教社字第1110134679號
50,新竹市私立成真文理短期補習班,2022-08-10,新竹市經國路三段92巷10號1樓,"1.未提供與該班學生簽立定型化契約。2.未提供投保公共意外責任險。3.未提供線上登錄設立人、班主任、教職員工名冊 (身份證字號、西元出生年月日等)。(未確實核備教職員工)4.未提供補習班個人資料安全維護計畫。5.未提供「短期補習班從業人員接種COVID-19防疫管理指引自我檢查表」及「短期補習班從業人員接種COVID-19防疫名冊」。6.出入人員未落實體溫量測及盤點從業人員及學生造冊。7.        未提供建築公共安全簽證申報都市發展處回函。8.        未辦理建築物公安簽證申報，現場張貼不合格告示，並限於7日內補辦；於未完成申報並取得通知書前，不得擅自撕毀告示，以免觸犯刑法第141條損毀文告罪。告示編號:1110810-1。",限期改善件次,2022-08-17,府教社字第1110126037號
51,新竹市私立盧老師文理短期補習班,2022-08-03,新竹市食品路478號1樓,"1.未提供與該班學生簽立定型化契約。2.未提供投保公共意外責任險。3.未提供補習班個人資料安全維護計畫。4.未提供線上登錄設立人、班主任、教職員工名冊 (身份證字號、西元出生年月日等)。5.        未提供收費收據未記載退費規定。6.擅自增設國文會考科目、作文科目，國中英文科目。7.未提供「短期補習班從業人員接種COVID-19防疫管理指引自我檢查表」及「短期補習班從業人員接種COVID-19防疫名冊」。",糾正件次(列入違規紀錄),2022-08-08,府教社字第1110121804號
52,新竹市私立權慧文理短期補習班,2022-07-27,新竹市光華街95巷18號1樓,"1未與該班學生簽立定型化契約2. 未提供補習班個人資料安全維護計畫。3. 有提供收費收據有記載退費規定，惟與本府規定不符合。4.現場稽查教室1座位有34個座位，與本府核准立案不符合(核准立案人數每班14人)。5.出入人員未採實聯制，並盤點從業人員及學生造冊。6.未提供「短期補習班從業人員接種COVID-19防疫管理指引自我檢查表」。7.        無法保持通風之教室或密閉空間，以不開放為原則。維持教室之學習場域環境通風；開冷氣或空調時，門可關閉，但應開啟扇窗，每扇至少開啟15公分，以利通風。現場稽查4間教室未開扇窗保持通風。",糾正件次(列入違規紀錄),2022-07-28,府教社字第1110116961號
53,新竹市私立喬太文理短期補習班,2022-07-20,新竹市經國路一段379巷41號3樓,"1. 未與該班學生簽立定型化契約。2. 未提供補習班個人資料安全維護計畫。3. 未提供線上登錄設立人、班主任、教職員工名冊 (身份證字號、西元出生年月日等)。4. 有使用車輛載送學生，車輛未核備。5. 收費收據有記載退費規定，惟與本府規定不符合。6. 違規使用經國路一段379巷41號3樓。(原立案9間教室，現場稽核10間教室)7. 出入人員未採實聯制，並盤點從業人員及學生造冊。8. 未提供「短期補習班從業人員接種COVID-19防疫管理指引自我檢查表」及「短期補習班從業人員接種COVID-19防疫名冊」。9. 未提供建築物公共安全簽證申報都市發展處回函。",糾正件次(列入違規紀錄),2022-08-22,府教社字第1110113314號
54,新竹市私立亮榮昌文理短期補習班,2022-05-11,新竹市明湖路180號2樓之2,"1. 未與該班學生簽立定型化契約。2. 未提供補習班個人資料安全維護計畫。3. 未提供線上登錄設立人、班主任、教職員工名冊 (身份證字號、西元出生年月日等)。4. 擅自增設國中菁英科目、國三會考科目、國一先修科目。5. 違規變更班址使用明湖路180號一樓二樓之2。6. 建築物公共安全簽證申報都市發展處函要提改 善。7. 一樓未設消防設備及未檢修申報。8. 未提供「短期補習班從業人員接種COVID-19防疫管理指引自我檢查表」及「短期補習班從業人員接種COVID-19防疫名冊」。",糾正件次(列入違規紀錄),2022-05-19,府教社字第1110080756號
55,新竹市私立文欣文理短期補習班,2022-05-04,新竹市建功一路152號1樓至4樓,"1. 未與該班學生簽立定型化契約。2. 未提供補習班個人資料安全維護計畫。3. 未提供線上登錄設立人、班主任、教職員工名冊 (身份證字號、西元出生年月日等)。 現場查核有3位老師、1位職員與系統登錄資料不符。4.        違規變更班址使用建功路1號1樓。5. 出入人員未採實聯制，並盤點從業人員及學生造冊。6. 未提供「短期補習班從業人員接種COVID-19防疫管理指引自我檢查表」及「短期補習班從業人員接種COVID-19防疫名冊」。",糾正件次(列入違規紀錄),2022-05-12,府教社字第1110077282號
56,新竹市私立喬安文理短期補習班,2022-04-20,新竹市四維路100號1至4樓,"1.未與該班學生簽立定型化契約。2. 未提供補習班個人資料安全維護計畫。3. 未提供線上登錄設立人、班主任、教職員工名冊 (身份證字號、西元出生年月日等)。4. 違規變更班址使用四維路100號5樓。5. 出入人員未採實聯制，並盤點從業人員及學生造冊。6. 未提供「短期補習班從業人員接種COVID-19防疫管理指引自我檢查表」及「短期補習班從業人員接種COVID-19防疫名冊」7. 地墊未出示防焰物品證明，5樓未納入消防設備檢修申報。",糾正件次(列入違規紀錄),2022-04-22,府教社字第1110067647號
57,新竹市私立育碩文理短期補習班,2022-04-20,新竹市民富街155、157、159號1樓,"1. 未與該班學生簽立定型化契約。2. 未提供補習班個人資料安全維護計畫。3. 未提供線上登錄設立人、班主任、教職員工名冊 (身份證字號、西元出生年月日等)。4. 違規擴大使用民富街155、157、159號1樓。(原立案教室5間，現場稽查6間)5. 違規變更班址使用民富街155、157、159號地下室1樓。6. 出入人員未採實聯制，並盤點從業人員及學生造冊。7. 未提供「短期補習班從業人員接種COVID-19防疫管理指引自我檢查表」及「短期補習班從業人員接種COVID-19防疫名冊」。",糾正件次(列入違規紀錄),2022-04-21,府教社字第1110066785號
58,新竹市私立佳辰文理短期補習班,2022-04-13,新竹市光復路二段385號2樓至3樓,"1. 未與該班學生簽立定型化契約。2. 未提供補習班個人資料安全維護計畫。3. 未提供線上登錄設立人、班主任、教職員工名冊 (身份證字號、西元出生年月日等)。4. 未提供收費收據未記載退費規定。5. 違規擴大使用光復路二段385號2樓至3樓。(原立案教室2間，現場稽查6間)6. 違規變更班址使用光復路二段385號1樓及4樓。7. 出入人員未採實聯制，並盤點從業人員及學生造冊。8. 未提供「短期補習班從業人員接種COVID-19防疫管理指引自我檢查表」及「短期補習班從業人員接種COVID-19防疫名冊」。",糾正件次(列入違規紀錄),2022-04-14,府教社字第1110062881號
59,新竹市私立山葉鴻韻音樂短期補習班,2022-04-13,新竹市復興路16-5號2-4樓,"1. 未與該班學生簽立定型化契約。2. 未提供投保公共意外責任險。3. 未提供線上登錄設立人、班主任、教職員工名冊 (身份證字號、西元出生年月日等)。4. 未提供收費收據未記載退費規定。5. 懸掛招牌班名與核准立案班名不符合。6. 未提供學生及從業人員量測體溫名冊。7. 未提供「短期補習班從業人員接種COVID-19防疫管理指引自我檢查表」及「短期補習班從業人員接種COVID-19防疫名冊」。8. 2、3、4樓緩降機下降空間有障礙(招牌)，3、4樓百頁簾未見防焰標籤。建議加裝住宅用火災警報器，及早發現火災及早應變。",糾正件次(列入違規紀錄),2022-04-20,府教社字第1110062967號
60,新竹市私立佑孳學苑文理短期補習班,2022-03-23,新竹市光華東一街12號4樓,"有使用車輛載送學生，車輛未核備。 未與該班學生簽訂定型化契約。未提供補習班個人資料安全維護計畫。未提供線上登錄設立人、班主任、教職員工名冊 (身份證字號、西元出生年月日等)。收費收據未記載退費規定。違規擴大使用光華東一街12號4樓。(原立案4間教室，現場稽查5間教室)未提供學生及從業人員量測體溫名冊。未提供「短期補習班從業人員接種COVUD-19防疫管理指引自我查檢表」及疫苗接種名冊。",糾正件次(列入違規紀錄),2022-03-29,府教社字第1110054133號
61,新竹市私立吉尼文理短期補習班,2022-03-09,新竹市東區龍山里科學園路180號1樓至3樓,"未提供與該班學生簽立定型化契約。未提供補習班個人資料安全維護計畫。 收費收據未記載退費規定。懸掛招牌書寫安親班、課輔班字樣。違規擴大使用科學園路180號3樓。(原立案教室3間，現場稽查教室5間)違規變更班址至科學園路180號4樓。未提供「短期補習班從業人員接種COVUD-19防疫管理指引自我查檢表」。未提供「短期補習班從業人員接種COVUD-19疫苗名冊」。未依規辦理111年度消防安全設備檢修申報。(去年申報日期為：110年1月28日) 地上第4層樓應增設住宅用火災警報器。",糾正件次(列入違規紀錄),2022-03-10,府教社字第1110044598號
62,新竹市私立楊翰文理短期補習班,2021-12-22,新竹市南大路91-3號2-3樓,"未提供與該班學生簽立定型化契約。未提供線上登錄設立人、班主任、教職員工名冊 (身份證字號、西元出生年月日等)。 未提供及簽訂補習班個人資料安全維護計畫。收費收據未記載退費規定。未經本府核准，擅自增設作文科目、國小國文科目、朗讀科目、科展、自然科目，與核准立案科目不符。未經本府核准，違規變更班址將本市南大路91-3號1樓，擅自作為班舍使用，與核准立案班舍地址不符。立案證書未懸掛於班內明顯處。",糾正件次(列入違規紀錄),2021-12-24,府教社字第1100193528號
63,弋果文化事業股份有限公司附設新竹市私立弋果美語文理短期補習班經國分班,2021-12-15,新竹市經國路二段16號2樓至6樓,未經本府核准，違規變更班址將本市經國路二段16號1樓及7樓，擅自作為班舍使用，與核准立案班舍地址不符。,糾正件次(列入違規紀錄),2021-12-17,府教社字第1100190340號
64,弋果文化事業股份有限公司附設新竹市私立弋果美語文理短期補習班關埔分班,2021-12-08,新竹市東區埔頂一路203號2樓至6樓,未經本府核准，違規變更班址將本市埔頂一路203號1樓，擅自作為班舍使用，與核准立案班舍地址不符。,糾正件次(列入違規紀錄),2021-12-17,府教社字第1100189685號
65,新竹市私立文昌文理短期補習班,2021-12-01,新竹市中埔里3鄰祥園街61號1-2樓,1.未提供與該班學生簽立定型化契約。未提供補習班個人資料安全維護計畫收費收據有記載退費規定，惟與本府規定不符合。懸掛招牌書寫安親班、課輔班字樣，與核准立案科目不符合。未經本府核准，將本市祥園街61號1-2樓教室擴大使用，與本府核准立案教室數量不符。(原核准立案2間教室，現場稽核3間教室)。無定期填報因應COVID-19防疫管理指引自我檢查表。,糾正件次(列入違規紀錄),2021-12-07,府教社字第1100181306號
66,新竹市私立博佑語文短期補習班,2021-11-25,新竹市博愛街93號1樓至2樓,"未提供線上登錄設立人、班主任、教職員工名冊 (身份證字號、西元出生年月日等)，職工未於補習班資訊系統核備。收費收據未記載退費規定。未經本府核准，將本市博愛街93號1-2樓 (原立案教室4間，現場稽查6間教室)擅自擴大教室使用，與核准立案教室數量不符。本府核准立案班級人數每班為20人，經現場稽查部分教室逾核定人數。",糾正件次(列入違規紀錄),2021-12-01,府教社字第100180248號
67,新竹市私立康寧關新文理才藝短期補習班,2021-11-17,新竹市關新北路181號1樓,"有使用車輛載送學生，車輛未核備。未提供補習班個人資料安全維護計畫。未提供線上登錄設立人、班主任、教職員工名冊 (身份證字號、西元出生年月日等)。未提供收費收據。懸掛招牌班名有關新分班字樣與核准立案班名不符合。未經本府核准，將本市關新北路181號1樓、2樓之間夾層空間擅自作為班舍使用，與核准立案班舍地址不符。(原核准立案2間教室，現場稽核6間教室)。2樓(夾層)未列入消防檢修申報範圍。",糾正件次(列入違規紀錄),2021-11-22,府教社字第1100175172號
68,新竹市私立智恩文理短期補習班,2021-11-17,新竹市關新北路153號1樓,"有使用車輛載送學生，車輛未核備。未提供線上登錄設立人、班主任、教職員工名冊 (身份證字號、西元出生年月日等)。收費收據未記載退費規定。懸掛招牌書寫課照班字樣與核准立案不符合。未經本府核准，將本市關新北路153號1樓、2樓之間夾層空間擅自作為班舍使用，與核准立案班舍地址不符。(原核准立案5間教室，現場稽核7間教室)。未辦理建築公安簽證申報，未提供資料。",糾正件次(列入違規紀錄),2021-11-22,府教社字第1100175234號
69,新竹市私立竹科芝蔴街美語文理短期補習班,2021-11-17,新竹市關新路51號2-3樓,未提供補習班個人資料安全維護計畫。未經本府核准，將本市關新路51號3樓(原立案教室6間，現場稽查7間教室)擅自將陽台擴大成教室使用，與核准立案教室數量不符。,糾正件次(列入違規紀錄),2021-11-22,府教社字第1100175135號
70,新竹市私立博釋文理短期補習班,2021-11-17,新竹市東區關新東路168號1-3樓,"未與該班學生簽立定型化契約。未提供補習班個人資料安全維護計畫。未提供線上登錄設立人、班主任、教職員工名冊 (身份證字號、西元出生年月日等)。收費收據未記載退費規定。懸掛招牌班名有關東分校字樣與核准立案班名不符合。本府核准立案班級人數每班為16人，經現場稽查部分教室逾核定人數。",糾正件次(列入違規紀錄),2021-11-22,府教社字第1100175358號
71,新竹市私立嘉德琳世傑文理短期補習班,2021-11-17,新竹市世傑路230號2樓,"未提供與該班學生簽立定型化契約。未提供補習班個人資料安全維護計畫。未提供線上登錄設立人、班主任、教職員工名冊 (身份證字號、西元出生年月日等)。未提供收費收據。未懸掛立案證書於班舍明顯處。擅自增設美術科目，與核准立案科目不符合。未辦理建築公安簽證申報。緩降機固定架附近堆積雜物無法操作使用。",糾正件次(列入違規紀錄),2021-11-22,府教社字第1100175034號
72,新竹市私立名師文理短期補習班,2021-11-10,新竹市經國路二段438巷11號1樓及13號1樓,"未提供與該班學生簽立定型化契約。未提供補習班個人資料安全維護計畫。有提供線上登錄設立人、班主任、教職員工名冊 (身份證字號、西元出生年月日等)。(教職人員線上登錄未一致，系統登錄4位，查核實際有5位)收費收據未記載退費規定。懸掛招牌班名與核准立案班名科目不符合。(名師數位文理短期補習班)擅自增設國中國文科、國中自然科、全科課輔科目，與核准立案科目不符合。",糾正件次(列入違規紀錄),2021-11-11,府教社字第1100170395號
73,新竹市私立暘光美語短期補習班,2021-11-03,新竹市博愛街83號2樓,"未與該班學生簽訂定型化契約。2. 未提供補習班個人資料安全維護計畫。3. 未完成線上登錄設立人、班主任、教職員工名冊 (身份證字號、西元出生年月日等)。4. 收費收據未記載退費規定。5. 查貴班未經本府核准，將本市博愛街83號1-2樓(原立案教室2間，現場稽查7間教室)擅自擴大教室使用，與本府核准立案教室數量不符。6. 查貴班未經本府核准，將本市博愛街83號1-2樓擅自作為班舍使用，與本府核准立案班舍地址不符。",糾正件次(列入違規紀錄),2021-11-10,府教社字第1100169091號
